{
  "$schema": "https://json-schema.org/draft/2020-12/schema",
  "$id": "https://conet.network/schema/dle-archive-tendermint-corpus-v2.schema.json",
  "title": "CoNET-DLE Archive Tendermint executable corpus v2",
  "type": "object",
  "additionalProperties": false,
  "required": [
    "schema",
    "revision",
    "supersedesProseStateVectorsFrom",
    "compatibility",
    "constants",
    "errorEnums",
    "rejectReasons",
    "containers",
    "certificateReference",
    "certificateVectors",
    "coordinatorVectors",
    "walVectors",
    "rsVectors",
    "rsReconstructionSets",
    "stateMachineVectors",
    "lifecycleVectors"
  ],
  "properties": {
    "schema": {
      "const": "dle.archive.tendermint.corpus.v2"
    },
    "revision": {
      "type": "string",
      "format": "date"
    },
    "supersedesProseStateVectorsFrom": {
      "const": "DLE-Archive-Tendermint-Vectors-v1.json"
    },
    "compatibility": {
      "type": "object",
      "additionalProperties": false,
      "required": ["v1Preserved", "legacyProposalVoteVectors"],
      "properties": {
        "v1Preserved": {
          "const": true
        },
        "legacyProposalVoteVectors": {
          "type": "array",
          "minItems": 6,
          "items": {
            "$ref": "#/$defs/legacySszVector"
          }
        }
      }
    },
    "constants": {
      "type": "object",
      "required": [
        "protocolVersion",
        "activeArchives",
        "readyStandbys",
        "quorum",
        "noneRound",
        "nilValue",
        "signatureBytes",
        "certificateSignerSlots",
        "wal",
        "rs"
      ],
      "properties": {
        "protocolVersion": {
          "$ref": "#/$defs/bytes32"
        },
        "activeArchives": {
          "const": 5
        },
        "readyStandbys": {
          "const": 2
        },
        "quorum": {
          "const": 4
        },
        "noneRound": {
          "const": 4294967295
        },
        "nilValue": {
          "const": "0x0000000000000000000000000000000000000000000000000000000000000000"
        },
        "signatureBytes": {
          "const": 65
        },
        "certificateSignerSlots": {
          "const": 5
        },
        "wal": {
          "type": "object",
          "required": [
            "magicAscii",
            "version",
            "headerBytes",
            "checksumBytes",
            "checksum",
            "safetyRecord"
          ],
          "properties": {
            "magicAscii": {
              "const": "DLEW"
            },
            "version": {
              "const": 1
            },
            "headerBytes": {
              "const": 52
            },
            "checksumBytes": {
              "const": 32
            },
            "checksum": {
              "const": "SHA-256"
            },
            "safetyRecord": {
              "type": "string"
            }
          },
          "additionalProperties": false
        },
        "rs": {
          "type": "object",
          "required": [
            "name",
            "n",
            "k",
            "field",
            "primitivePolynomial",
            "generatorMatrix",
            "frame",
            "leafHash",
            "padLeaf",
            "branchHash"
          ],
          "properties": {
            "name": {
              "const": "dle.rs.v1"
            },
            "n": {
              "const": 7
            },
            "k": {
              "const": 4
            },
            "field": {
              "const": "GF(2^8)"
            },
            "primitivePolynomial": {
              "const": "0x11d"
            },
            "generatorMatrix": {
              "type": "array",
              "minItems": 7,
              "maxItems": 7,
              "items": {
                "type": "array",
                "minItems": 4,
                "maxItems": 4,
                "items": {
                  "type": "integer",
                  "minimum": 0,
                  "maximum": 255
                }
              }
            },
            "frame": {
              "type": "string"
            },
            "leafHash": {
              "type": "string"
            },
            "padLeaf": {
              "type": "string"
            },
            "branchHash": {
              "type": "string"
            }
          },
          "additionalProperties": false
        }
      },
      "additionalProperties": false
    },
    "errorEnums": {
      "type": "array",
      "minItems": 20,
      "uniqueItems": true,
      "items": {
        "type": "string",
        "pattern": "^ERR_[A-Z0-9_]+$"
      }
    },
    "rejectReasons": {
      "type": "array",
      "minItems": 8,
      "items": {
        "type": "object",
        "additionalProperties": false,
        "required": ["name", "code", "evidenceRequired"],
        "properties": {
          "name": {
            "type": "string"
          },
          "code": {
            "type": "integer",
            "minimum": 1,
            "maximum": 65535
          },
          "evidenceRequired": {
            "const": true
          }
        }
      }
    },
    "containers": {
      "type": "object",
      "required": [
        "ProposalSignBytesV1",
        "VoteSignBytesV1",
        "PrevoteQCV2",
        "ArchiveCertificateV2",
        "TimeoutCertificateV2",
        "CandidateRejectCertificateV2"
      ],
      "properties": {
        "ProposalSignBytesV1": {
          "$ref": "#/$defs/containerFields"
        },
        "VoteSignBytesV1": {
          "$ref": "#/$defs/containerFields"
        },
        "PrevoteQCV2": {
          "$ref": "#/$defs/containerFields"
        },
        "ArchiveCertificateV2": {
          "$ref": "#/$defs/containerFields"
        },
        "TimeoutCertificateV2": {
          "$ref": "#/$defs/containerFields"
        },
        "CandidateRejectCertificateV2": {
          "$ref": "#/$defs/containerFields"
        }
      },
      "additionalProperties": false
    },
    "certificateReference": {
      "type": "string"
    },
    "certificateVectors": {
      "type": "array",
      "minItems": 4,
      "items": {
        "$ref": "#/$defs/certificateVector"
      }
    },
    "coordinatorVectors": {
      "type": "array",
      "minItems": 1,
      "items": {
        "$ref": "#/$defs/vector"
      }
    },
    "walVectors": {
      "type": "array",
      "minItems": 3,
      "items": {
        "$ref": "#/$defs/vector"
      }
    },
    "rsVectors": {
      "type": "array",
      "minItems": 3,
      "items": {
        "type": "object",
        "additionalProperties": false,
        "required": [
          "id",
          "body",
          "bodyLength",
          "shardSize",
          "shards",
          "bodyCommitment",
          "daRoot"
        ],
        "properties": {
          "id": {
            "type": "string"
          },
          "body": {
            "$ref": "#/$defs/hex"
          },
          "bodyLength": {
            "type": "integer",
            "minimum": 0
          },
          "shardSize": {
            "type": "integer",
            "minimum": 2
          },
          "shards": {
            "type": "array",
            "minItems": 7,
            "maxItems": 7,
            "items": {
              "$ref": "#/$defs/hex"
            }
          },
          "bodyCommitment": {
            "$ref": "#/$defs/bytes32"
          },
          "daRoot": {
            "$ref": "#/$defs/bytes32"
          }
        }
      }
    },
    "rsReconstructionSets": {
      "type": "array",
      "minItems": 35,
      "maxItems": 35,
      "uniqueItems": true,
      "items": {
        "type": "array",
        "minItems": 4,
        "maxItems": 4,
        "items": {
          "type": "integer",
          "minimum": 0,
          "maximum": 6
        }
      }
    },
    "stateMachineVectors": {
      "type": "array",
      "minItems": 5,
      "items": {
        "$ref": "#/$defs/vector"
      }
    },
    "lifecycleVectors": {
      "type": "array",
      "minItems": 1,
      "items": {
        "$ref": "#/$defs/vector"
      }
    }
  },
  "$defs": {
    "hex": {
      "type": "string",
      "pattern": "^0x(?:[0-9a-f]{2})*$"
    },
    "containerFields": {
      "type": "array",
      "items": {
        "type": "array",
        "minItems": 2,
        "maxItems": 2,
        "prefixItems": [
          {
            "type": "string"
          },
          {
            "enum": [
              "bytes4",
              "bytes32",
              "bytes65",
              "uint8",
              "uint16",
              "uint32",
              "uint64",
              "uint256",
              "bytes32x5",
              "bytes65x5"
            ]
          }
        ],
        "items": false
      }
    },
    "bytes32": {
      "type": "string",
      "pattern": "^0x[0-9a-f]{64}$"
    },
    "vector": {
      "type": "object",
      "required": ["id", "expected"],
      "properties": {
        "id": {
          "type": "string"
        },
        "initial": {},
        "input": {},
        "inputs": {
          "type": "array"
        },
        "frame": {
          "$ref": "#/$defs/hex"
        },
        "expected": {}
      }
    },
    "legacySszVector": {
      "type": "object",
      "required": [
        "id",
        "type",
        "signatureDomainTag",
        "input",
        "canonicalSsz",
        "hashTreeRoot",
        "signingRoot"
      ],
      "properties": {
        "id": {
          "type": "string"
        },
        "type": {
          "enum": ["ProposalSignBytesV1", "VoteSignBytesV1"]
        },
        "signatureDomainTag": {
          "type": "string"
        },
        "input": {
          "type": "object"
        },
        "canonicalSsz": {
          "$ref": "#/$defs/hex"
        },
        "hashTreeRoot": {
          "$ref": "#/$defs/bytes32"
        },
        "signingRoot": {
          "$ref": "#/$defs/bytes32"
        }
      }
    },
    "certificateVector": {
      "type": "object",
      "additionalProperties": false,
      "required": [
        "id",
        "container",
        "input",
        "canonicalSsz",
        "hashTreeRoot",
        "signingRoot",
        "certificateRef"
      ],
      "properties": {
        "id": {
          "type": "string"
        },
        "container": {
          "enum": [
            "PrevoteQCV2",
            "ArchiveCertificateV2",
            "TimeoutCertificateV2",
            "CandidateRejectCertificateV2"
          ]
        },
        "input": {
          "type": "object"
        },
        "canonicalSsz": {
          "$ref": "#/$defs/hex"
        },
        "hashTreeRoot": {
          "$ref": "#/$defs/bytes32"
        },
        "signingRoot": {
          "$ref": "#/$defs/bytes32"
        },
        "certificateRef": {
          "$ref": "#/$defs/bytes32"
        }
      }
    }
  }
}
