{
  "schema": "dle.archive.tendermint.corpus.v2",
  "revision": "2026-08-13",
  "supersedesProseStateVectorsFrom": "DLE-Archive-Tendermint-Vectors-v1.json",
  "compatibility": {
    "v1Preserved": true,
    "legacyProposalVoteVectors": [
      {
        "id": "SSZ-PROPOSAL-NO-VALID",
        "type": "ProposalSignBytesV1",
        "signatureDomainTag": "dle.archive.proposal.v1",
        "input": {
          "validRoundOrNone": 4294967295,
          "validPrevoteQCRefOrZero": "0x0000000000000000000000000000000000000000000000000000000000000000"
        },
        "canonicalSsz": "0x06c8ad5ba4b5da846bda64f2f14ed297a12fd7d4bc9b2f7e0c28ca572dd8483fa66c03000000000007000000000000002a00000000000000000000000000000000000000000000000000000000000000090000000000000002000000c22aa4e9f8a69f660a9ede9d91a069ae2fddc679a3ccd48f67654db6643f9493ffffffff000000000000000000000000000000000000000000000000000000000000000003000000000000000b0000000000000011111111111111111111111111111111111111111111111111111111111111110500000000000000",
        "hashTreeRoot": "0x0af7294ce69fe0c42cdb24a901bd2e9c535e4aa6221b26a32b17b7792c21c757",
        "signingRoot": "0xe6e1d74dbddcd11cbae8bc5e25a6bbc0221096fb8e2b30255c1500cf6658ecef"
      },
      {
        "id": "SSZ-PROPOSAL-VALID-ROUND-1",
        "type": "ProposalSignBytesV1",
        "signatureDomainTag": "dle.archive.proposal.v1",
        "input": {
          "validRoundOrNone": 1,
          "validPrevoteQCRefOrZero": "0xabababababababababababababababababababababababababababababababab"
        },
        "canonicalSsz": "0x06c8ad5ba4b5da846bda64f2f14ed297a12fd7d4bc9b2f7e0c28ca572dd8483fa66c03000000000007000000000000002a00000000000000000000000000000000000000000000000000000000000000090000000000000002000000c22aa4e9f8a69f660a9ede9d91a069ae2fddc679a3ccd48f67654db6643f949301000000abababababababababababababababababababababababababababababababab03000000000000000b0000000000000011111111111111111111111111111111111111111111111111111111111111110500000000000000",
        "hashTreeRoot": "0xc7a72bdbe8d08522a3cd3bd07eca81e5e811e028a4697b340ebb8c0072d5060b",
        "signingRoot": "0x9e507ef7640d018599020e1f866dea664b76bcdeac902981498f0a4ab369c90b"
      },
      {
        "id": "SSZ-PREVOTE-ACCEPT",
        "type": "VoteSignBytesV1",
        "signatureDomainTag": "dle.archive.vote.v1",
        "input": {
          "step": 1,
          "valueHashOrZero": "0xc22aa4e9f8a69f660a9ede9d91a069ae2fddc679a3ccd48f67654db6643f9493",
          "prevoteQCRefOrZero": "0x0000000000000000000000000000000000000000000000000000000000000000"
        },
        "canonicalSsz": "0x06c8ad5ba4b5da846bda64f2f14ed297a12fd7d4bc9b2f7e0c28ca572dd8483fa66c03000000000007000000000000002a0000000000000000000000000000000000000000000000000000000000000009000000000000000200000001c22aa4e9f8a69f660a9ede9d91a069ae2fddc679a3ccd48f67654db6643f949303000000000000000b00000000000000111111111111111111111111111111111111111111111111111111111111111105000000000000000000000000000000000000000000000000000000000000000000000000000000",
        "hashTreeRoot": "0xda3dc38126779d884f807cef5797e4dbe97707d70a13970972b7d91b72cb0c15",
        "signingRoot": "0x31ffeecd1ba1eddd2adc320eb3aacf82294e51e22b320d6a7b0255cc3474dcbf"
      },
      {
        "id": "SSZ-PREVOTE-NIL",
        "type": "VoteSignBytesV1",
        "signatureDomainTag": "dle.archive.vote.v1",
        "input": {
          "step": 1,
          "valueHashOrZero": "0x0000000000000000000000000000000000000000000000000000000000000000",
          "prevoteQCRefOrZero": "0x0000000000000000000000000000000000000000000000000000000000000000"
        },
        "canonicalSsz": "0x06c8ad5ba4b5da846bda64f2f14ed297a12fd7d4bc9b2f7e0c28ca572dd8483fa66c03000000000007000000000000002a0000000000000000000000000000000000000000000000000000000000000009000000000000000200000001000000000000000000000000000000000000000000000000000000000000000003000000000000000b00000000000000111111111111111111111111111111111111111111111111111111111111111105000000000000000000000000000000000000000000000000000000000000000000000000000000",
        "hashTreeRoot": "0xf6bab9337ccad5c674cc0840ec5ce9bb8ab40ce51f3839798a4b4a8fd6e0dcdf",
        "signingRoot": "0xd9de909838ed155b0eb4fc46b6adfb7a55f7e07998f5cc377eeb0e13963d9e61"
      },
      {
        "id": "SSZ-PRECOMMIT-ACCEPT",
        "type": "VoteSignBytesV1",
        "signatureDomainTag": "dle.archive.vote.v1",
        "input": {
          "step": 2,
          "valueHashOrZero": "0xc22aa4e9f8a69f660a9ede9d91a069ae2fddc679a3ccd48f67654db6643f9493",
          "prevoteQCRefOrZero": "0xabababababababababababababababababababababababababababababababab"
        },
        "canonicalSsz": "0x06c8ad5ba4b5da846bda64f2f14ed297a12fd7d4bc9b2f7e0c28ca572dd8483fa66c03000000000007000000000000002a0000000000000000000000000000000000000000000000000000000000000009000000000000000200000002c22aa4e9f8a69f660a9ede9d91a069ae2fddc679a3ccd48f67654db6643f949303000000000000000b0000000000000011111111111111111111111111111111111111111111111111111111111111110500000000000000abababababababababababababababababababababababababababababababab",
        "hashTreeRoot": "0x64bbf7fc11f328bf51b6d9bbc7be33c8387ce6bb5c5f42bba7e8c500439250b8",
        "signingRoot": "0x436a9fc8a93943eb8177c2da51b6f32ad11af38636d01c79e876afd9bcfb664b"
      },
      {
        "id": "SSZ-PRECOMMIT-NIL",
        "type": "VoteSignBytesV1",
        "signatureDomainTag": "dle.archive.vote.v1",
        "input": {
          "step": 2,
          "valueHashOrZero": "0x0000000000000000000000000000000000000000000000000000000000000000",
          "prevoteQCRefOrZero": "0x0000000000000000000000000000000000000000000000000000000000000000"
        },
        "canonicalSsz": "0x06c8ad5ba4b5da846bda64f2f14ed297a12fd7d4bc9b2f7e0c28ca572dd8483fa66c03000000000007000000000000002a0000000000000000000000000000000000000000000000000000000000000009000000000000000200000002000000000000000000000000000000000000000000000000000000000000000003000000000000000b00000000000000111111111111111111111111111111111111111111111111111111111111111105000000000000000000000000000000000000000000000000000000000000000000000000000000",
        "hashTreeRoot": "0xf8cbf2c7c17160b9f0bf0a085535b4ca1f531ba170f389b6aba93c799e208baf",
        "signingRoot": "0x5545e721bb1683118ee64849876097a4ac0155019acbe4b93f942c235a3375c5"
      }
    ]
  },
  "constants": {
    "protocolVersion": "0x3291fbf416c139f892b870ef87cf18d584fe156e918dea6fcb77f3feb0876b7b",
    "activeArchives": 5,
    "readyStandbys": 2,
    "quorum": 4,
    "noneRound": 4294967295,
    "nilValue": "0x0000000000000000000000000000000000000000000000000000000000000000",
    "signatureBytes": 65,
    "certificateSignerSlots": 5,
    "wal": {
      "magicAscii": "DLEW",
      "version": 1,
      "headerBytes": 52,
      "checksumBytes": 32,
      "checksum": "SHA-256",
      "safetyRecord": "uint16le(version) || uint8(kind) || uint8(domain) || uint64le(height) || uint32le(round) || uint8(step) || uint32le(signBytesLength) || signBytes || signingRoot[32] || signature[65] || proposalHash[32] || lockedValue[32] || uint32le(lockedRound) || validValue[32] || uint32le(validRound) || qcRef[32] || tcRef[32] || uint64le(membershipEpoch) || membershipRoot[32] || uint64le(keyEpoch) || uint64le(committedHeight)"
    },
    "rs": {
      "name": "dle.rs.v1",
      "n": 7,
      "k": 4,
      "field": "GF(2^8)",
      "primitivePolynomial": "0x11d",
      "generatorMatrix": [
        [
          1,
          0,
          0,
          0
        ],
        [
          0,
          1,
          0,
          0
        ],
        [
          0,
          0,
          1,
          0
        ],
        [
          0,
          0,
          0,
          1
        ],
        [
          82,
          247,
          2,
          166
        ],
        [
          247,
          7,
          4,
          245
        ],
        [
          2,
          4,
          213,
          210
        ]
      ],
      "frame": "uint64le(bodyLength) || body || zero-padding",
      "leafHash": "SHA-256(0x00 || uint32le(index) || uint64le(bodyLength) || shard)",
      "padLeaf": "SHA-256(0x02)",
      "branchHash": "SHA-256(0x01 || left || right)"
    }
  },
  "errorEnums": [
    "ERR_INVALID_CANONICAL_SSZ",
    "ERR_SIGNING_ROOT_MISMATCH",
    "ERR_NIL_ENCODING",
    "ERR_INVALID_VALID_ROUND",
    "ERR_LOCK_CONFLICT",
    "ERR_INVALID_CERTIFICATE_KIND",
    "ERR_INVALID_CERTIFICATE_REFERENCE",
    "ERR_INVALID_QUORUM",
    "ERR_DUPLICATE_SIGNER",
    "ERR_NON_CANONICAL_SIGNER_ORDER",
    "ERR_SIGNER_NOT_ACTIVE",
    "ERR_WAL_DOUBLE_SIGN",
    "ERR_WAL_RECOVERY_REQUIRED",
    "ERR_WAL_SEQUENCE",
    "ERR_MEMBERSHIP_NOT_ACTIVE",
    "ERR_MEMBERSHIP_ROOT_MISMATCH",
    "ERR_MIXED_MEMBERSHIP_ROOT",
    "ERR_KEY_EPOCH_MISMATCH",
    "ERR_AMBIGUOUS_L1_MEMBERSHIP_CHECKPOINT",
    "ERR_REJECT_ACCEPT_CONFLICT",
    "ERR_REJECT_AFTER_FINALITY",
    "ERR_INVALID_REJECT_REASON",
    "ERR_INVALID_REJECT_EVIDENCE",
    "ERR_INVALID_COORDINATOR",
    "ERR_INVALID_RS_CODEWORD",
    "ERR_INSUFFICIENT_SHARDS",
    "ERR_LIFECYCLE_TRANSITION"
  ],
  "rejectReasons": [
    {
      "name": "InvalidValidatorQuorum",
      "code": 1,
      "evidenceRequired": true
    },
    {
      "name": "InvalidStateTransition",
      "code": 2,
      "evidenceRequired": true
    },
    {
      "name": "BodyCommitmentMismatch",
      "code": 3,
      "evidenceRequired": true
    },
    {
      "name": "DaRootMismatch",
      "code": 4,
      "evidenceRequired": true
    },
    {
      "name": "InvalidRsCodeword",
      "code": 5,
      "evidenceRequired": true
    },
    {
      "name": "UnavailableBody",
      "code": 6,
      "evidenceRequired": true
    },
    {
      "name": "InvalidParentCertificate",
      "code": 7,
      "evidenceRequired": true
    },
    {
      "name": "MembershipMismatch",
      "code": 8,
      "evidenceRequired": true
    }
  ],
  "containers": {
    "ProposalSignBytesV1": [
      [
        "protocolVersion",